name,explanation,image_url,topic_description
PNP-BIPOLAR-Junction.png,"The image is a diagram of  a PNP bipolar junction transistor (BJT), an electronic component used to amplify or switch signals. The transistor has three regions: the emitter (E), base (B), and collector (C).

Emitter (E): Emits holes into the base.
Base (B): Controls the flow of holes from the emitter to the collector.
Collector (C): Collects the holes that have passed through the base.
When the transistor is on, a small base current allows a larger current to flow from the emitter to the collector. The transistor is controlled by the base-emitter voltage; a positive voltage at the base relative to the emitter enables current flow, overcoming the depletion region that normally blocks current in the off state.",https://qkbjnciqtosdvknjsqeo.supabase.co/storage/v1/object/public/images/public/PNP-BIPOLAR-Junction.png?,"A PNP bipolar junction transistor (BJT) is a crucial electronic component used to amplify or switch signals in electrical and electronic engineering. The transistor consists of three regions: the emitter (E), base (B), and collector (C). The emitter emits holes into the base, while the collector collects the holes that have passed through the base. The base controls the flow of holes from the emitter to the collector.

The PNP BJT is a type of transistor that uses a positive-negative-positive (PNP) configuration. When the transistor is on, a small base current allows a larger current to flow from the emitter to the collector. The transistor is controlled by the base-emitter voltage; a positive voltage at the base relative to the emitter enables current flow, overcoming the depletion region that normally blocks current in the off state.

The PNP BJT is widely used in various applications, including amplifiers, switches, and digital circuits. Its importance lies in its ability to amplify weak signals, making it an essential component in many electronic devices. The transistor's high current gain and low noise make it an ideal choice for applications where signal integrity is crucial.

The impact of the PNP BJT is significant, as it has revolutionized the field of electrical and electronic engineering. Its development has enabled the creation of complex electronic systems, such as computers, televisions, and mobile phones. The transistor's ability to amplify signals has also enabled the development of long-distance communication systems, such as radio and telephone networks.

In summary, the PNP BJT is a vital electronic component that plays a crucial role in amplifying or switching signals in electrical and electronic engineering. Its importance lies in its ability to amplify weak signals, and its impact has been significant in revolutionizing the field of electrical and electronic engineering."
Diode-Transistor-Logic.png,"The image is a digram of the DTL (Diode-Transistor-Logic) circuit is mostly accurate but contains some errors. In a typical DTL circuit, the transistor's emitter should be connected to ground, not to a resistor and diode. The output ""Q2"" is usually connected to further logic circuitry or a load rather than directly to the power supply ""Vcc."" Therefore, the transistor's connections and the role of the output point need adjustment to accurately represent a DTL logic gate, such as an inverter or NOR gate, based on the correct configuration of the resistors and diodes.",https://qkbjnciqtosdvknjsqeo.supabase.co/storage/v1/object/public/images/public/Diode-Transistor-Logic.png?,"Diode-Transistor-Logic (DTL) is a type of digital logic circuit that uses diodes and transistors to perform logical operations. It is an improvement over the earlier Diode Logic (DL) and Transistor Logic (TL) circuits, offering better performance and reliability. DTL circuits are widely used in digital electronics, particularly in the design of integrated circuits, microprocessors, and other digital systems.

In a DTL circuit, diodes are used to provide the necessary logic functions, such as inversion and negation, while transistors are used to amplify the signals and improve the circuit's noise immunity. The diodes act as switches, controlling the flow of current to the transistors, which in turn control the output of the circuit. This combination of diodes and transistors allows DTL circuits to perform complex logical operations with high speed and accuracy.

DTL circuits have several advantages over other digital logic circuits, including:

* Improved noise immunity due to the use of transistors
* Higher switching speeds due to the use of diodes and transistors
* Lower power consumption compared to other digital logic circuits
* Ability to perform complex logical operations with high accuracy

DTL circuits are widely used in digital electronics, particularly in the design of:

* Integrated circuits (ICs)
* Microprocessors
* Memory devices
* Digital signal processing systems
* Control systems

Overall, DTL circuits offer a reliable and efficient way to perform digital logic operations, making them an essential component of modern digital electronics."
Gate-Turn-Off-Thyristor.jpg,"The image is a diagram of the Gate Turn-Off Thyristor (GTO), also known as the Gated Turn-Off Thyristor. It consists of two anodes, one cathode, and three terminals: gate, emitter, and collector. The diagram shows how the GTO works in operation.

In this circuit, the GTO is connected to a resistor, which limits the current flowing through it. The voltage across the GTO is controlled by the gate terminal, which can be used to turn the device on or off. When the gate is triggered, the GTO becomes conductive, allowing current to flow between the anode and cathode. If the gate is de-triggered, the GTO becomes non-conductive, cutting off the current flow.

The diagram also includes a rule that governs the behavior of the GTO when the gate is turned off. This rule states that if the gate is de-triggered while the current is still flowing, the GTO will continue to conduct until the current reaches zero. At this point, the GTO will automatically become non-conductive, preventing further current flow.

Overall, the GTO is a type of thyristor that allows for controlled switching of electrical current, making it useful in applications such as motor control and power electronics.",https://qkbjnciqtosdvknjsqeo.supabase.co/storage/v1/object/public/images/public/Gate-Turn-Off-Thyristor.jpg?,"A Gate-Turn-Off Thyristor (GTO) is a type of semiconductor device used in electrical and electronic engineering to control the flow of electrical current. It is a three-terminal device, consisting of two anodes, one cathode, and a gate terminal. The GTO is a type of thyristor, which is a family of devices that can be used to switch electrical current on and off.

The GTO is used to control the flow of current in applications such as motor control, power electronics, and power supplies. It is particularly useful in situations where a high degree of control over the current flow is required, such as in the control of large motors or in the regulation of power supplies.

One of the key benefits of the GTO is its ability to be turned off, even when the current is flowing. This is achieved through the use of a gate terminal, which can be used to trigger the GTO and turn it on, and then de-trigger it to turn it off. This allows for precise control over the current flow, making the GTO a valuable component in many electrical and electronic systems.

The GTO is also used in applications where a high degree of reliability is required, such as in the control of medical equipment or in the operation of industrial machinery. Its ability to be turned off and on makes it a more reliable option than some other types of thyristors, which can only be turned on and off by interrupting the current flow.

Overall, the GTO is an important device in electrical and electronic engineering, providing a high degree of control over the flow of electrical current. Its ability to be turned off and on makes it a valuable component in many applications, and its reliability and precision make it a popular choice among engineers and technicians."
Infrared-Diode.png,"An IR diode is an electronic component used to convert electrical signals into optical signals, but the term ""emitter terminal"" is not typically used for an IR diode. Instead, it has an anode and a cathode. The key component is the p-n junction, which emits infrared light when an electrical current passes through it.",https://qkbjnciqtosdvknjsqeo.supabase.co/storage/v1/object/public/images/public/Infrared-Diode.png?,"Infrared-Diode (IR-Diode) is a crucial component in electrical and electronic engineering, playing a vital role in various applications. It is a type of semiconductor device that converts electrical signals into optical signals, emitting infrared light when an electric current passes through it.

The IR-diode consists of a p-n junction, where the p-type material is rich in holes (positive charge carriers) and the n-type material is rich in electrons (negative charge carriers). When an electric current is applied, the holes and electrons recombine, releasing energy in the form of infrared photons. This process is known as electroluminescence.

IR-diodes are widely used in various applications, including:

1. **Remote controls**: IR-diodes are used in remote controls to transmit infrared signals to receive devices, such as TVs, air conditioners, and other appliances.
2. **Infrared communication**: IR-diodes are used in infrared communication systems, such as IrDA (Infrared Data Association) devices, which enable data transfer between devices without the need for cables.
3. **Night vision**: IR-diodes are used in night vision devices, such as thermal imaging cameras, to detect heat signatures in low-light environments.
4. **Sensors**: IR-diodes are used in various sensors, including temperature sensors, motion sensors, and proximity sensors, which detect changes in infrared radiation.

The importance of IR-diodes lies in their ability to transmit data wirelessly and in their use in various applications where infrared radiation is used to detect or measure physical properties. The impact of IR-diodes is significant, as they have enabled the development of various technologies, including remote controls, infrared communication systems, and night vision devices.

In summary, IR-diodes are essential components in electrical and electronic engineering, playing a vital role in various applications where infrared radiation is used to transmit data or detect physical properties."
Light-Dependent-Resistor.jpg,"The image is a diagram of a light-dependent resistor (LDR), which is a type of electronic component that changes its resistance based on the amount of light it receives. The diagram shows two LDRs with different configurations: the one on the left has two pins, and the one on the right also has two pins. Both components are connected to a power source and a load, represented by a resistor.",https://qkbjnciqtosdvknjsqeo.supabase.co/storage/v1/object/public/images/public/Light-Dependent-Resistor.jpg?,"A Light-Dependent Resistor (LDR) is an electronic component that changes its resistance in response to the amount of light it receives. This property makes it a crucial component in various applications, particularly in optoelectronics and automation.

LDRs are widely used in various fields, including:

1. **Optical Sensors**: LDRs are used to detect changes in light intensity, making them ideal for applications such as light-sensitive alarms, photoelectric switches, and optical communication systems.
2. **Automation**: LDRs are used in automation systems to control lighting, temperature, and other environmental factors. For instance, they can be used to turn on lights when the room becomes dark or to adjust the temperature based on the amount of sunlight.
3. **Robotics**: LDRs are used in robotics to detect obstacles, navigate through environments, and perform tasks that require light sensitivity.
4. **Security Systems**: LDRs are used in security systems to detect intruders, monitor lighting conditions, and trigger alarms.

The importance of LDRs lies in their ability to:

1. **Measure Light Intensity**: LDRs can measure the intensity of light, making them useful for applications that require monitoring light levels.
2. **Provide Feedback**: LDRs provide feedback to the system, enabling it to make decisions based on the light intensity.
3. **Enable Automation**: LDRs enable automation by providing a means to control devices based on light intensity.

The impact of LDRs is significant, as they:

1. **Improve Safety**: LDRs can improve safety by detecting changes in light intensity, which can indicate potential hazards.
2. **Enhance Efficiency**: LDRs can enhance efficiency by automating tasks and reducing energy consumption.
3. **Increase Accuracy**: LDRs can increase accuracy by providing precise measurements of light intensity.

In summary, LDRs are a crucial component in various applications, particularly in optoelectronics and automation. Their ability to measure light intensity and provide feedback makes them a valuable tool for improving safety, efficiency, and accuracy."
Light-Emitting-Diode.jpg,"The image is a simple circuit diagram that shows an anode and a cathode connected to a diode. The anode is represented by the ""+"" symbol, while the cathode is represented by the ""-"" symbol. The diode is depicted as a black rectangle with two terminals, one for the anode and one for the cathode.",https://qkbjnciqtosdvknjsqeo.supabase.co/storage/v1/object/public/images/public/Light-Emitting-Diode.jpg?,"In the field of electrical and electronic engineering, a Light-Emitting-Diode (LED) is a semiconductor device that produces light when an electric current passes through it. LEDs are widely used in various applications, including lighting, displays, and indicators.

An LED consists of two types of materials, p-type (positive) and n-type (negative), which are combined to form a p-n junction. When a voltage is applied across the LED, electrons from the n-type material flow towards the p-type material, releasing energy in the form of light. The color of the light emitted depends on the energy gap of the semiconductor material used.

LEDs have several advantages over traditional incandescent bulbs and other light sources. They are energy-efficient, producing minimal heat and consuming less power. They also have a longer lifespan, typically ranging from 50,000 to 100,000 hours, compared to incandescent bulbs which last around 1,000 to 2,000 hours. Additionally, LEDs are environmentally friendly, as they contain no toxic materials and do not produce greenhouse gases.

LEDs are used in a variety of applications, including:

* Lighting: residential, commercial, and industrial lighting
* Displays: LED screens, TVs, and monitors
* Indicators: traffic lights, warning lights, and status indicators
* Automotive: headlights, taillights, and interior lighting
* Communication: optical communication systems, fiber optic cables

The importance of LEDs lies in their ability to provide efficient, reliable, and sustainable lighting solutions. They have revolutionized the way we light our homes, streets, and workplaces, reducing energy consumption and environmental impact."
Miller-effect-capacitance.png,"The image is a diagram of a Miller-effect capacitor, which is a type of variable capacitor that can be used to tune radio receivers. The circuit consists of two capacitors (C1 and C2) connected in parallel with each other, as well as a resistor (R) and a variable resistor (V). The variable resistor controls the amount of current flowing through the circuit, allowing for adjustments to the capacitance of the device.
",https://qkbjnciqtosdvknjsqeo.supabase.co/storage/v1/object/public/images/public/Miller-effect-capacitance.png?,"The Miller-effect-capacitance is a fundamental concept in electrical and electronic engineering, particularly in the design of radio frequency (RF) circuits and tunable filters. It refers to the increase in capacitance of a capacitor due to the presence of a series resistor, known as the Miller effect. This phenomenon occurs when a capacitor is connected in parallel with a resistor, and the output voltage of the capacitor is taken across the resistor.

In the context of RF circuits, the Miller-effect-capacitance is crucial for achieving high-Q (quality factor) filters and resonant circuits. By adjusting the value of the series resistor, the capacitance of the device can be varied, allowing for precise tuning of the circuit. This is particularly important in applications such as radio receivers, where the ability to tune into different frequencies is essential.

The Miller-effect-capacitance is also used in the design of variable capacitors, such as those used in tunable filters and resonant circuits. By incorporating a variable resistor in the circuit, the capacitance of the device can be adjusted, allowing for fine-tuning of the circuit.

The importance of the Miller-effect-capacitance lies in its ability to provide a high degree of control over the capacitance of a device, making it an essential component in many RF circuits. Its impact is felt in various applications, including radio communication systems, medical imaging devices, and radar systems, where precise tuning and filtering are critical.

In summary, the Miller-effect-capacitance is a vital concept in electrical and electronic engineering, particularly in the design of RF circuits and tunable filters. Its ability to provide a high degree of control over capacitance makes it an essential component in many applications, and its impact is felt in various industries where precise tuning and filtering are critical."
Operational-Amplifier.png,"The image is a simplified schematic diagram of an operational amplifier (Op-amp) circuit. The Op-amp is a key component in electronic circuits, used for amplification and signal processing.

In the diagram, there are two main inputs: a non-inverting input (+) and an inverting input (-). These inputs can be connected to different sources or signals depending on the desired function of the circuit.

The output of the Op-amp is represented by Vout, which can be either positive or negative depending on the relationship between the input voltages at the inverting and non-inverting terminals. In this example, the output is shown as being driven by the inverting input, indicating that it is more sensitive to changes in the voltage at the inverting terminal than at the non-inverting terminal.

The Op-amp also has internal feedback mechanisms that help maintain stability and prevent oscillation. This is represented by the resistor Rf, which provides negative feedback from the output back to the inverting input. The resistor R1 represents the gain of the amplifier, with higher values resulting in greater amplification.

Overall, the Op-amp is a versatile tool for manipulating and processing electrical signals, making it a fundamental building block in many electronic systems.",https://qkbjnciqtosdvknjsqeo.supabase.co/storage/v1/object/public/images/public/Operational-Amplifier.png?,"Operational-Amplifier (Op-amp) is a fundamental component in electrical and electronic engineering, used for amplification, signal processing, and noise reduction in various electronic circuits. It is a high-gain amplifier with a differential input and a single-ended output, capable of providing a high degree of accuracy and stability.

The Op-amp is used in a wide range of applications, including audio equipment, medical devices, industrial control systems, and telecommunications. Its importance lies in its ability to amplify weak signals, reject noise, and provide a high degree of accuracy and stability.

The Op-amp is a critical component in many electronic systems, including:

1. Amplification: Op-amps are used to amplify weak signals, making them suitable for applications where a strong signal is required.
2. Signal processing: Op-amps are used to filter, modify, and shape signals, making them suitable for applications where signal processing is required.
3. Noise reduction: Op-amps are used to reject noise and provide a clean output signal.
4. Control systems: Op-amps are used in control systems, such as temperature control, pressure control, and flow control.

The impact of Op-amps on electronic systems is significant, as they enable the creation of high-performance electronic circuits that are accurate, stable, and reliable. They have revolutionized the field of electronics, enabling the development of complex systems that are capable of performing a wide range of tasks.

In summary, the Operational-Amplifier is a critical component in electronic engineering, used for amplification, signal processing, and noise reduction. Its importance lies in its ability to provide high accuracy, stability, and reliability, making it a fundamental building block in many electronic systems."
Field-Effect-Transistor1.jpg,"The image is a schematic diagram of an n-channel FET (Field-Effect Transistor) transistor. The two main components in the diagram are the source (s) and drain (d). In this particular configuration, there is also a channel (c) between the source and drain. This type of FET is typically used as a voltage-controlled switch that can be turned on or off by applying a voltage to the gate (g)",https://qkbjnciqtosdvknjsqeo.supabase.co/storage/v1/object/public/images/public/Field-Effect-Transistor1.jpg?,"A Field-Effect Transistor (FET) is a type of transistor that uses an electric field to control the flow of current between two terminals. In the context of electrical and electronic engineering, FETs are a crucial component in modern electronics, offering numerous advantages over traditional bipolar junction transistors (BJTs).

FETs are used as voltage-controlled switches, which can be turned on or off by applying a voltage to the gate (g). This property makes them ideal for applications where low power consumption, high input impedance, and fast switching times are required. FETs are commonly used in a wide range of devices, including amplifiers, switches, and logic circuits.

The importance of FETs lies in their ability to provide high input impedance, which makes them suitable for applications where the input signal is weak or sensitive. FETs also offer low power consumption, making them an attractive option for battery-powered devices. Additionally, FETs can be used to implement complex digital circuits, such as logic gates and arithmetic circuits, due to their high switching speed and low power consumption.

The impact of FETs on electrical and electronic engineering has been significant. They have enabled the development of smaller, faster, and more efficient electronic devices, which has led to numerous innovations in fields such as computing, telecommunications, and consumer electronics. FETs have also played a crucial role in the advancement of modern technologies, including the Internet of Things (IoT), artificial intelligence, and robotics.

In summary, FETs are a fundamental component in modern electronics, offering numerous advantages over traditional transistors. Their importance lies in their ability to provide high input impedance, low power consumption, and fast switching times, making them suitable for a wide range of applications. The impact of FETs on electrical and electronic engineering has been significant, enabling the development of smaller, faster, and more efficient electronic devices."
Norton.png,Norton's theorem states that any linear electrical network with multiple sources and resistors can be simplified to an equivalent circuit with a single current source in parallel with a single resistor. This makes analyzing complex circuits easier by focusing on the equivalent Norton current and resistance,https://qkbjnciqtosdvknjsqeo.supabase.co/storage/v1/object/public/images/public/Norton.png?,"Norton's theorem is a fundamental concept in electrical and electronic engineering that simplifies the analysis of complex electrical networks. It states that any linear network with multiple sources and resistors can be reduced to an equivalent circuit with a single current source in parallel with a single resistor. This equivalent circuit is known as the Norton equivalent circuit.

The usage of Norton's theorem is widespread in electrical engineering, particularly in the design and analysis of electronic circuits, power systems, and control systems. By converting a complex circuit to its Norton equivalent, engineers can easily analyze and design circuits that contain multiple sources and resistors, such as voltage dividers, filters, and amplifiers.

The importance of Norton's theorem lies in its ability to simplify complex circuit analysis, making it easier to understand and design electrical networks. It also provides a convenient way to analyze circuits with multiple sources, which is a common occurrence in many electrical systems. Additionally, Norton's theorem is closely related to Thevenin's theorem, which deals with voltage sources, providing a complete set of tools for circuit analysis.

The impact of Norton's theorem is significant, as it has revolutionized the way electrical engineers approach circuit analysis and design. By reducing complex circuits to their Norton equivalent, engineers can focus on the essential aspects of the circuit, making it easier to identify and optimize circuit performance. Furthermore, Norton's theorem has led to the development of various circuit analysis techniques and tools, such as the use of impedance and admittance, which have become essential in electrical engineering."
