name,explanation,image_url,topic_description
2-input-and-gate.png,"This image is a diagram that illustrates the process of inputting data and passing it through a gate in an electronic circuit. The truth table below the diagram shows the relationship between the inputs (A, B) and the output (Y). In this case, the gate operates as an AND gate, which means that the output will only be true (1) if both inputs are true (1).",https://qkbjnciqtosdvknjsqeo.supabase.co/storage/v1/object/public/images/public/2-input-and-gate.png?,"The 2-input AND gate is a fundamental component in electronic circuits, playing a crucial role in digital logic systems. It is a type of digital logic gate that takes two binary inputs, A and B, and produces an output, Y, based on the logical AND operation.

The AND gate operates as follows: if both inputs, A and B, are true (1), the output, Y, is true (1). However, if either or both inputs are false (0), the output is also false (0). This means that the output is only true if all inputs are true, making it a logical AND operation.

The 2-input AND gate is essential in digital logic systems, as it allows designers to create complex digital circuits using basic building blocks. It is used in a wide range of applications, including:

1. **Digital computing**: AND gates are used to implement logical operations, such as multiplication and division, in digital computers.
2. **Control systems**: AND gates are used to create logic circuits that control the flow of data and signals in control systems.
3. **Communication systems**: AND gates are used to implement logic operations in communication systems, such as telephone switching systems.
4. **Automotive systems**: AND gates are used in automotive systems, such as airbag deployment and anti-lock braking systems.

The importance of the 2-input AND gate lies in its ability to create complex digital circuits using basic logic operations. It is a fundamental component in digital logic systems, enabling designers to create reliable and efficient digital circuits. The impact of the AND gate is significant, as it has enabled the development of modern digital technology, including computers, smartphones, and other digital devices."
2-input-or-gate.PNG,"This image shows a 2-input OR gate, which is a basic digital logic gate that performs the logical operation of OR. The truth table for this gate is also provided in the diagram.

The input A and B are connected to the inputs of the OR gate, while the output represents the result of the OR operation between these two inputs. In this case, if either input A or B is at logic level 1 (true), the output will be at logic level 1 as well. If both inputs are at logic level 0 (false), the output will remain at logic level 0.",https://qkbjnciqtosdvknjsqeo.supabase.co/storage/v1/object/public/images/public/2-input-or-gate.PNG?,"In the realm of electrical and electronic engineering, a 2-input OR gate is a fundamental digital logic gate that plays a crucial role in various electronic circuits and systems. The OR gate is a basic building block of digital logic, and its operation is essential in processing and manipulating binary information.

The 2-input OR gate performs the logical operation of OR, which means that the output is at logic level 1 (true) if either or both of the input signals are at logic level 1. This gate is commonly used in digital circuits to implement various logic functions, such as arithmetic operations, control signals, and decision-making processes.

The importance of the 2-input OR gate lies in its ability to simplify complex digital logic circuits. By using OR gates in conjunction with other logic gates, such as AND and NOT gates, engineers can design and implement a wide range of digital systems, including microprocessors, memory chips, and other digital integrated circuits.

The impact of the 2-input OR gate is significant in various fields, including:

1. **Digital Computing**: OR gates are used in the design of digital computers, where they perform arithmetic and logical operations.
2. **Control Systems**: OR gates are used in control systems to implement decision-making processes and to generate control signals.
3. **Communication Systems**: OR gates are used in communication systems to implement error detection and correction mechanisms.
4. **Microprocessors**: OR gates are used in microprocessors to implement arithmetic and logical operations.

In summary, the 2-input OR gate is a fundamental digital logic gate that plays a crucial role in various electronic circuits and systems. Its simplicity and versatility make it an essential component in digital logic design, and its impact is significant in various fields, including digital computing, control systems, communication systems, and microprocessors."
3-input-and-gate.png,"The image is a diagram that represents a 3-input AND gate. The gate has three input terminals labeled A, B, and C, which are connected to the inputs of an AND gate.
In addition, there is a table called ""Truth Table"" below the diagram. This table shows the possible combinations of input values for each terminal (A, B, and C), as well as the corresponding output value for each combination. For example, if all three inputs are set to 1, then the output will also be 1. If any of the inputs are set to 0, then the output will be 0 regardless of the other inputs.

",https://qkbjnciqtosdvknjsqeo.supabase.co/storage/v1/object/public/images/public/3-input-and-gate.png?,"In electrical and electronic engineering, a 3-input AND gate is a digital logic circuit that performs a fundamental operation in digital electronics. It is a type of digital logic gate that takes three binary inputs and produces a binary output based on the logical AND operation.

The 3-input AND gate is a crucial component in digital circuits, particularly in computer hardware and microprocessors. It is used to implement logical operations, such as conditional statements and decision-making processes. The gate has three input terminals labeled A, B, and C, which are connected to the inputs of the AND gate. The output of the gate is 1 only if all three inputs are 1; otherwise, the output is 0.

The importance of the 3-input AND gate lies in its ability to perform complex logical operations efficiently and reliably. It is used in various applications, including:

1. **Digital logic circuits**: The 3-input AND gate is used to implement logical operations, such as conditional statements, decision-making processes, and arithmetic operations.
2. **Computer hardware**: The gate is used in microprocessors, memory chips, and other digital components to perform logical operations.
3. **Control systems**: The 3-input AND gate is used in control systems, such as traffic lights, elevator controllers, and industrial automation systems, to make decisions based on multiple conditions.
4. **Digital signal processing**: The gate is used in digital signal processing applications, such as image and audio processing, to perform logical operations on digital signals.

In summary, the 3-input AND gate is a fundamental component in digital electronics, enabling the implementation of complex logical operations efficiently and reliably. Its importance extends to various applications, including digital logic circuits, computer hardware, control systems, and digital signal processing."
3-input-or-gate.png,"The image is a diagram of a 3-input OR gate, which is a digital logic gate that outputs true (1) when any one of its three inputs A, B, or C is true. The truth table below the diagram shows the input-output relationship for this gate.
",https://qkbjnciqtosdvknjsqeo.supabase.co/storage/v1/object/public/images/public/3-input-or-gate.png?,"In the field of electrical and electronic engineering, a 3-input OR gate is a fundamental digital logic gate that plays a crucial role in various electronic circuits and systems. The OR gate is a type of logic gate that outputs a true or high signal (1) if any one of its three inputs is true or high. This means that the output of the gate will be true if at least one of the inputs A, B, or C is true.

The 3-input OR gate is widely used in digital circuits, computer systems, and microcontrollers to perform logical operations, such as data selection, error detection, and control logic. Its importance lies in its ability to simplify complex logical operations by reducing the number of gates required.

In digital electronics, the 3-input OR gate is used to implement various functions, including:

1. Data selection: The OR gate can be used to select one of three inputs based on a control signal.
2. Error detection: The OR gate can be used to detect errors in digital data by checking for any one of the inputs to be true.
3. Control logic: The OR gate can be used to implement control logic in microcontrollers and digital systems.

The impact of the 3-input OR gate is significant, as it enables the design of more complex digital circuits and systems. Its widespread use has led to the development of various digital technologies, including:

1. Microcontrollers: The OR gate is used in microcontrollers to implement control logic and data selection.
2. Digital systems: The OR gate is used in digital systems to perform logical operations and error detection.
3. Computer networks: The OR gate is used in computer networks to implement data selection and control logic.

In summary, the 3-input OR gate is a fundamental digital logic gate that plays a crucial role in various electronic circuits and systems. Its importance lies in its ability to simplify complex logical operations and its widespread use has led to the development of various digital technologies."
AND-gate-using-transistor.png,"The base terminal of both the transistors Q1 and Q2 are connected to inputs A and B, respectively through resistors R1 & R2, and finally, the emitter terminal of the transistor Q2 is connected directly to the ground using a resistor. When both input terminals are at a high voltage(1), it allows current to flow through the transistor, turning on the output terminal(1). If either input terminals are at low(0) voltage, no current flows, keeping the output terminal off(0).",https://qkbjnciqtosdvknjsqeo.supabase.co/storage/v1/object/public/images/public/AND-gate-using-transistor.png?,"**AND-Gate using Transistor**

In the field of electrical and electronic engineering, an AND-gate is a fundamental digital logic circuit that produces an output only when all its inputs are high. In this context, an AND-gate using transistor is a simple implementation of this circuit using bipolar junction transistors (BJTs). This circuit is crucial in digital electronics as it is used to perform logical operations, such as arithmetic and control operations, in digital systems.

The AND-gate using transistor consists of two transistors, Q1 and Q2, with their base terminals connected to inputs A and B, respectively, through resistors R1 and R2. The emitter terminal of transistor Q2 is connected directly to the ground through a resistor. When both input terminals are at a high voltage (1), it allows current to flow through both transistors, turning on the output terminal (1). If either input terminal is at a low voltage (0), no current flows, keeping the output terminal off (0).

The importance of the AND-gate using transistor lies in its simplicity and reliability. It is widely used in digital circuits, such as arithmetic logic units (ALUs), microprocessors, and memory chips. The impact of this circuit is significant, as it enables the construction of more complex digital systems, such as computers, smartphones, and other electronic devices that rely on digital logic operations.

In digital electronics, the AND-gate using transistor is a fundamental building block, and its proper functioning is critical to the overall performance of digital systems. Its reliability and simplicity make it an essential component in the design of digital circuits, and its widespread use has revolutionized the field of electrical and electronic engineering."
DIAC-Construction.PNG,"A diac is a two-terminal, three layer bidirectional device which can be switched from its OFF state to ON state for either polarity of applied voltage. The diac can be constructed in either npn or pnp form. Fig. 21.17 (i) shows the basic structure of a diac in pnp form. The two leads are connected to p-regions of silicon separated by an n-region. The structure of diac is very much similar to that of a transistor. Fig. 21.17 (ii) shows the symbol of a diac.",https://qkbjnciqtosdvknjsqeo.supabase.co/storage/v1/object/public/images/public/DIAC-Construction.PNG?,"The topic DIAC-Construction is a crucial aspect of electrical and electronic engineering, referring to the design and fabrication of a Diode for Alternating Current, commonly known as a DIAC. A DIAC is a two-terminal, three-layer bidirectional device that can be switched from its OFF state to ON state for either polarity of applied voltage.

In the context of electrical and electronic engineering, DIACs are used as voltage-controlled switches, enabling or disabling the flow of current in a circuit. They are widely employed in applications such as lighting control systems, power supplies, and motor control circuits. The DIAC's ability to conduct current in both directions makes it an essential component in circuits that require bidirectional switching.

The importance of DIACs lies in their simplicity, reliability, and low cost. They are easy to integrate into circuits and can withstand high voltage and current stresses. Additionally, DIACs are used in protection circuits to prevent damage to equipment due to overvoltage or overcurrent conditions.

The impact of DIACs on electrical and electronic engineering is significant, enabling the development of more efficient and reliable power systems. They have played a crucial role in the design of modern power electronics, allowing for the creation of high-performance power supplies, motor drives, and other applications. The widespread use of DIACs has also led to the development of more sophisticated control systems, further advancing the field of electrical and electronic engineering."
DIAC-characteristics-curve.PNG,"The following characteristic curve shows the relation between the main voltage and main current of a DIAC. As you can see, the DIAC only operate in 1st and 3rd quadrant. It is a symmetrical device; therefore, the graph is symmetrical in both quadrants forming the shape of letter “Z”.In 1st quadrant, the voltage and current are positive. As you can see, when the voltage is below the break over voltage VBO, the DIAC blocks the current except for the leakage current. The device remains in OFF-state. Once the voltage increases, the DIAC triggers into ON-state and the current rises. The voltage across the device starts to reduce to steady ON-state voltage.

The device operates similarly in the 3rd quadrant. The only difference between the 1st and 3rd quadrant is that the voltage and current are reverse. That is it.",https://qkbjnciqtosdvknjsqeo.supabase.co/storage/v1/object/public/images/public/DIAC-characteristics-curve.PNG?,"In the context of electrical and electronic engineering, the DIAC (Diode for Alternating Current) is a type of semiconductor device that is used to control the flow of electrical current. The DIAC-characteristics-curve is a graphical representation of the relationship between the main voltage and main current of a DIAC.

The curve shows that the DIAC operates in the 1st and 3rd quadrants, indicating that it can conduct current in both forward and reverse bias modes. The curve is symmetrical in both quadrants, forming the shape of a ""Z"" letter, which is a characteristic of the DIAC's operation.

In the 1st quadrant, the DIAC blocks current below the breakover voltage (VBO), remaining in the OFF-state. Once the voltage increases, the DIAC triggers into the ON-state, and the current rises. The voltage across the device reduces to a steady ON-state voltage.

The DIAC-characteristics-curve is important in electrical and electronic engineering as it helps designers and engineers understand the behavior of DIACs in various applications, such as rectification, voltage regulation, and power supplies. The curve provides valuable information about the DIAC's operating range, switching characteristics, and steady-state behavior, enabling the selection and design of suitable DIACs for specific applications.

The DIAC-characteristics-curve has a significant impact on the design and development of electronic circuits, as it allows engineers to predict and optimize the performance of DIAC-based circuits. The curve's symmetrical shape also indicates that the DIAC can be used in both AC and DC applications, making it a versatile component in electronic engineering."
Forward-Blocking-mode-SCR.PNG,"The image shows a forward-blocking mode silicon controlled rectifier (SCR) circuit diagram. In the forward blocking mode, the SCR is forward biased by connecting the anode (A) to the positive terminal and the cathode (K) to the negative terminal of the power supply. 
Junctions J1 and J3 are forward biased.Junction J2 is reverse biased.Although J1 and J3 allow current to flow, J2 prevents it due to its reverse-biased state. Consequently, the SCR remains in a high-impedance state, blocking any significant current, except for a small leakage current (forward leakage current).",https://qkbjnciqtosdvknjsqeo.supabase.co/storage/v1/object/public/images/public/Forward-Blocking-mode-SCR.PNG?,"A Forward-Blocking-mode Silicon Controlled Rectifier (SCR) is a type of thyristor that plays a crucial role in electrical and electronic engineering. It is a semiconductor device used to control the flow of electrical current in various applications.

In the context of electrical and electronic engineering, the Forward-Blocking-mode SCR is used to prevent the flow of current in a circuit when it is not required. This mode of operation is essential in applications where a device needs to be switched on or off, such as in power supplies, motor control circuits, and lighting systems.

The importance of the Forward-Blocking-mode SCR lies in its ability to provide a high degree of control over the flow of electrical current. When the SCR is in the forward-blocking mode, it acts as a high-impedance device, blocking any significant current flow. This is achieved by reverse-biasing the junction (J2) that controls the flow of current. As a result, the SCR remains in a high-impedance state, preventing any substantial current flow, except for a small leakage current.

The usage of Forward-Blocking-mode SCR is widespread in various industries, including power electronics, motor control, and lighting systems. Its importance cannot be overstated, as it provides a reliable means of controlling the flow of electrical current, which is essential in many applications. The impact of the Forward-Blocking-mode SCR is significant, as it enables the efficient and safe operation of electrical systems, reducing the risk of electrical shocks and equipment damage.

In summary, the Forward-Blocking-mode SCR is a vital component in electrical and electronic engineering, providing a high degree of control over the flow of electrical current. Its importance lies in its ability to prevent the flow of current when not required, making it an essential device in various applications."
Forward-conducting-mode-SCR.PNG,"The image is a diagram of a forward-conducting mode silicon controlled rectifier (SCR). This can be achieved in two ways:
Break Over Voltage (VB): By increasing the anode-cathode voltage beyond a specific threshold called the breakover voltage (VB), the reverse-biased junction J2 breaks down. This results in a large current flow through the SCR.
Gate Triggering: By applying a positive voltage to the gate terminal (G) relative to the cathode (K), the SCR can be triggered into conduction without requiring the voltage to reach the breakover level. The gate current induces carriers in the J2 junction, making it conductive and allowing current to flow from anode to cathode.",https://qkbjnciqtosdvknjsqeo.supabase.co/storage/v1/object/public/images/public/Forward-conducting-mode-SCR.PNG?,"A Forward-conducting-mode Silicon Controlled Rectifier (SCR) is a type of thyristor that plays a crucial role in electrical and electronic engineering. It is a three-layer semiconductor device that can be used to control the flow of electrical current. The SCR is designed to conduct current in the forward direction, allowing it to regulate the flow of power in various applications.

The SCR is used in a wide range of applications, including power supplies, motor control, and power conditioning systems. Its primary function is to act as a switch, allowing current to flow when triggered and blocking it when not. This makes it an essential component in modern power electronics.

One of the key advantages of the SCR is its ability to handle high voltage and current levels, making it suitable for applications where high power is required. Additionally, the SCR is relatively simple and inexpensive to manufacture, which contributes to its widespread adoption.

The SCR's operation can be triggered in two ways: by applying a voltage across the anode-cathode terminals, known as Break Over Voltage (VB), or by applying a positive voltage to the gate terminal, known as gate triggering. The gate triggering method allows for more precise control over the SCR's operation, as it can be triggered into conduction without requiring the voltage to reach the breakover level.

In summary, the forward-conducting-mode SCR is a vital component in electrical and electronic engineering, providing a means to control and regulate the flow of power in various applications. Its ability to handle high voltage and current levels, combined with its simplicity and affordability, make it an essential tool in modern power electronics."
Full-adder-with-truth-table.png,"The image is a truth table for a full adder, which is a digital logic gate that performs addition of three binary numbers.  The truth table shows the input and output values for each combination of inputs A, B, and C. The outputs are represented by Sum (sum) and Carry (carry-out).",https://qkbjnciqtosdvknjsqeo.supabase.co/storage/v1/object/public/images/public/Full-adder-with-truth-table.png?,"A full-adder-with-truth-table is a digital logic gate that performs the addition of three binary numbers. It is a crucial component in digital electronics and computer systems, enabling the accurate calculation of sums and carry values in binary arithmetic. The truth table, a fundamental tool in digital design, illustrates the input-output relationships for each possible combination of inputs A, B, and C.

The full adder's functionality is essential in various applications, including:

1.  **Arithmetic Operations**: Full adders are used in the implementation of arithmetic circuits, such as adders, subtractors, and multipliers, which are fundamental components in digital signal processing and computing.
2.  **Digital Logic Circuits**: The truth table of a full adder serves as a reference for designing and verifying digital logic circuits, ensuring accurate and reliable operation.
3.  **Computer Systems**: Full adders are employed in the design of central processing units (CPUs), where they facilitate arithmetic operations, such as addition and subtraction, in the execution of instructions.
4.  **Digital Communication**: Full adders are used in digital communication systems, including modems and network interfaces, where they enable the accurate transmission and reception of binary data.

The impact of the full adder with truth table is significant, as it:

1.  **Enables Accurate Arithmetic**: By correctly calculating sums and carry values, full adders ensure the reliability and accuracy of digital arithmetic operations.
2.  **Facilitates Efficient Design**: The truth table provides a clear understanding of the full adder's behavior, facilitating the design and verification of digital logic circuits.
3.  **Supports High-Speed Computing**: Full adders are critical components in high-performance computing systems, where they enable rapid and accurate arithmetic operations.

In summary, the full adder with truth table is a fundamental component in digital electronics and computer systems, playing a crucial role in arithmetic operations, digital logic circuits, and high-speed computing. Its accurate and efficient design ensures the reliability and accuracy of digital arithmetic operations, making it an essential tool in digital design and development."
