name,explanation,image_url,topic_description
NOR-as-universal-gate.PNG,"The image is a schematic diagram of the implementation of base gates using NOR gate. It shows how multiple NOR gates can be combined to create basic gates (AND, OR and NOT).",https://qkbjnciqtosdvknjsqeo.supabase.co/storage/v1/object/public/images/public/NOR-as-universal-gate.PNG?,"In the context of electrical and electronic engineering, the NOR-as-universal-gate refers to the concept of using a single NOR gate to implement various basic logic gates, including AND, OR, and NOT gates. This approach is based on the idea that a NOR gate can be used as a building block to create other gates, making it a universal gate.

The NOR gate is a digital logic gate that produces an output of 1 only if both inputs are 0. It is a fundamental gate in digital electronics and is widely used in various applications. By combining multiple NOR gates, it is possible to create more complex logic functions, such as AND, OR, and NOT gates.

The importance of the NOR-as-universal-gate lies in its ability to simplify the design and implementation of digital circuits. By using a single NOR gate to create other gates, designers can reduce the number of components required, making the circuit more compact and efficient. This approach also allows for easier troubleshooting and maintenance of digital systems.

The impact of the NOR-as-universal-gate is significant in the field of digital electronics. It has led to the development of more complex digital circuits, such as microprocessors, memory chips, and other digital devices. The use of NOR gates as universal gates has also enabled the creation of more efficient and reliable digital systems, which has had a profound impact on various industries, including computing, communication, and automation."
NOR-gate.PNG,"The image is a representation of a NOR gate, which is an electronic logic gate. The diagram symbolizes the truth table and the logic diagram for this gate. In the truth table, there are two input variables (A and B) and one output variable (X). The logic diagram shows how these variables interact with each other to produce the output.",https://qkbjnciqtosdvknjsqeo.supabase.co/storage/v1/object/public/images/public/NOR-gate.PNG?,"In the realm of electrical and electronic engineering, the NOR-gate is a fundamental component of digital logic circuits. It is a type of electronic logic gate that produces an output only when both input variables are in a low or false state. The NOR gate is the opposite of the OR gate, where the output is high or true only when both inputs are high or true.

The NOR gate has two input variables, A and B, and one output variable, X. The truth table for the NOR gate shows that the output X is high (1) only when both inputs A and B are low (0). When either input A or B is high (1), or both are high (1), the output X is low (0).

The NOR gate is essential in digital logic circuits because it allows for the creation of complex logical operations. It is used in various applications, including computer arithmetic, data processing, and control systems. The NOR gate is also used in the design of microprocessors, memory chips, and other digital integrated circuits.

In digital logic circuits, the NOR gate is used to perform various functions, such as:

1. Inverting the output of another gate: By connecting the output of another gate to the input of a NOR gate, the output can be inverted, resulting in a high output when the original gate produces a low output.
2. Creating a delay: By cascading NOR gates, a delay can be created in the output signal, allowing for synchronization with other signals.
3. Implementing complex logical operations: By combining NOR gates with other gates, complex logical operations can be performed, such as multiplication, division, and modulo operations.

The NOR gate has a significant impact on digital logic circuits, enabling the creation of complex logical operations and allowing for the design of more efficient and compact digital integrated circuits. Its importance cannot be overstated, as it is a fundamental building block of modern digital electronics."
NOT-Gate.png,"The image is a diagram of a NOT gate, which is a basic logic gate in digital electronics. When A is 0, Y = A remains as 1 and when A is 1, the output Y becomes 0 due to the operation of the NOT gate. This means that the NOT gate inverts the input signal.",https://qkbjnciqtosdvknjsqeo.supabase.co/storage/v1/object/public/images/public/NOT-Gate.png?,"The NOT-Gate is a fundamental component in digital electronics, serving as a basic logic gate. It is used to invert the input signal, meaning that if the input is 0, the output is 1, and vice versa. This operation is crucial in digital circuits, enabling the creation of more complex logic functions.

The NOT-Gate is essential in various applications, including:

1. **Digital Logic Circuits**: The NOT-Gate is used to build more complex logic gates, such as AND, OR, and XOR gates, which are the building blocks of digital circuits.
2. **Computing and Processing**: NOT-Gates are used in digital computers to perform logical operations, such as negating a bit or inverting a signal.
3. **Control Systems**: In control systems, NOT-Gates are used to implement logic functions, such as debouncing switches or implementing timing circuits.

The importance of the NOT-Gate lies in its ability to invert the input signal, which is a fundamental operation in digital electronics. This allows for the creation of more complex logic functions, enabling the implementation of digital circuits and systems.

The NOT-Gate has a significant impact on digital electronics, as it is used in a wide range of applications, including:

1. **Microprocessors**: NOT-Gates are used in the design of microprocessors to implement logical operations and control the flow of data.
2. **Digital Signal Processing**: NOT-Gates are used in digital signal processing to implement logic functions and manipulate digital signals.
3. **Embedded Systems**: NOT-Gates are used in embedded systems to implement logic functions and control the behavior of the system.

In summary, the NOT-Gate is a fundamental component in digital electronics, enabling the creation of more complex logic functions and playing a crucial role in various applications, including digital logic circuits, computing and processing, and control systems."
OR-gate-using-transistor.png,"The image is a schematic diagram of an OR gate using  transistors. The circuit consists of two input terminals (A and B) connected to the base of the transistor, which controls the flow of current between the collector and emitter. When either input terminal is at a high voltage(1), it allows current to flow through the transistor, turning on the output terminal(1). If both input terminals are at low(0) voltage, no current flows, keeping the output terminal off(0).",https://qkbjnciqtosdvknjsqeo.supabase.co/storage/v1/object/public/images/public/OR-gate-using-transistor.png?,"In the field of electrical and electronic engineering, an OR-gate-using-transistor is a fundamental digital circuit that implements the OR logic operation using transistors. The OR gate is a basic building block of digital logic circuits, and its transistor implementation is a crucial component in the design of digital systems.

The OR gate using transistors is a crucial device in digital electronics, as it enables the creation of more complex digital circuits. In the context of digital logic, the OR gate produces an output of 1 if either or both of the input terminals are at a high voltage (1). This means that the output is 1 if there is any input that is 1. The OR gate is used extensively in digital systems, including computer processors, memory circuits, and digital communication systems.

The importance of the OR gate using transistors lies in its ability to implement the OR logic operation, which is essential for digital circuits to perform arithmetic and logical operations. The OR gate is used to create more complex digital circuits, such as adders, subtractors, and multiplexers. In addition, the OR gate is used in digital control systems, such as traffic lights and elevator control systems, where it is used to implement the logic required to control the system's operation.

The impact of the OR gate using transistors is significant, as it enables the creation of more complex digital systems. The OR gate is a fundamental component in the design of digital systems, and its transistor implementation is a crucial aspect of digital electronics. The widespread use of OR gates in digital systems has led to the development of more complex digital circuits, which have revolutionized the way we live and work.

In summary, the OR gate using transistors is a fundamental digital circuit that implements the OR logic operation using transistors. Its importance lies in its ability to create more complex digital circuits, and its impact is significant in the design of digital systems."
Reverse-blocking-mode-SCR.PNG,"In reverse blocking mode, the SCR is reverse biased with its anode connected to the negative terminal and cathode to the positive terminal. Junctions J1 and J3 are reverse biased, blocking current flow except for a negligible reverse saturation current. If the reverse voltage exceeds the reverse breakdown voltage, the SCR can undergo reverse breakdown, allowing a large reverse current that may damage the device.",https://qkbjnciqtosdvknjsqeo.supabase.co/storage/v1/object/public/images/public/Reverse-blocking-mode-SCR.PNG?,"Reverse-blocking-mode-SCR is a type of Silicon-Controlled Rectifier (SCR) that operates in a reverse-biased mode. In this mode, the SCR is connected with its anode to the negative terminal and cathode to the positive terminal of a power supply. This configuration is used to block current flow, except for a negligible reverse saturation current, which is typically in the range of microamperes.

The reverse-blocking-mode-SCR is used in various applications, including power supplies, motor control circuits, and surge protectors. Its importance lies in its ability to provide a high degree of isolation between the input and output circuits, which is essential in many electrical and electronic systems. The device also offers a high level of protection against voltage surges and electrical transients.

The reverse-blocking-mode-SCR is used in a variety of devices, including:

1. Power supplies: To provide a high degree of isolation between the input and output circuits, and to protect the output circuit from voltage surges and electrical transients.
2. Motor control circuits: To control the flow of current to the motor, and to provide a high degree of isolation between the control circuit and the motor.
3. Surge protectors: To protect electrical circuits from voltage surges and electrical transients.

The reverse-blocking-mode-SCR has a significant impact on the design and operation of electrical and electronic systems. Its ability to provide a high degree of isolation and protection against voltage surges and electrical transients makes it an essential component in many applications. However, if the reverse voltage exceeds the reverse breakdown voltage, the SCR can undergo reverse breakdown, allowing a large reverse current that may damage the device."
SCR-Crowbar-circuit.PNG,"A crowbar is a circuit that is used to protect a voltage-sensitive load from
excessive d.c. power supply output voltages. Fig. shows the SCR crowbar circuit. It consists of a zener diode, a gate resistor R G and an SCR. It also contains a snubber to prevent false triggering.",https://qkbjnciqtosdvknjsqeo.supabase.co/storage/v1/object/public/images/public/SCR-Crowbar-circuit.PNG?,"The SCR (Silicon-Controlled Rectifier) Crowbar Circuit is a crucial component in electrical and electronic engineering, particularly in the design of power supplies, motor control systems, and other applications where overvoltage protection is essential. The circuit is used to safeguard voltage-sensitive loads from excessive DC power supply output voltages, which can cause damage or malfunction.

The SCR Crowbar Circuit is a simple yet effective protection mechanism that relies on a Zener diode, a gate resistor, an SCR, and a snubber circuit. The Zener diode monitors the output voltage of the power supply and, when it exceeds a predetermined threshold, triggers the SCR, which then shorts the output voltage to ground, thus protecting the load. The gate resistor helps to limit the current flowing through the SCR, preventing false triggering. The snubber circuit, typically a capacitor and resistor combination, helps to prevent oscillations and ensures reliable operation.

The SCR Crowbar Circuit is essential in applications where overvoltage protection is critical, such as:

1. Power supplies: Protecting sensitive electronic components from excessive voltage surges.
2. Motor control systems: Preventing damage to motors and drivers from overvoltage conditions.
3. Renewable energy systems: Safeguarding inverters and other equipment from voltage spikes.
4. Industrial control systems: Protecting sensitive equipment from overvoltage conditions.

The SCR Crowbar Circuit is a reliable and cost-effective solution for overvoltage protection, offering several benefits, including:

1. Simple and low-cost implementation
2. High reliability and fault tolerance
3. Fast response time to overvoltage conditions
4. Effective protection of voltage-sensitive loads

In summary, the SCR Crowbar Circuit is a vital component in electrical and electronic engineering, providing essential overvoltage protection for sensitive loads in various applications."
SCR-Construction.jpg,"A Silicon Controlled Rectifier is a four layer, three terminal pnpn device with three junctions namely J1, J2, J3 with three terminals attached to the semiconductor materials namely anode (A), cathode (K) and gate (G).",https://qkbjnciqtosdvknjsqeo.supabase.co/storage/v1/object/public/images/public/SCR-Construction.jpg?,"SCR (Silicon Controlled Rectifier) is a type of thyristor, a four-layer, three-terminal semiconductor device used in electrical and electronic engineering. It is a crucial component in various applications due to its ability to control and regulate electrical power.

The SCR consists of three junctions (J1, J2, J3) and three terminals (anode, cathode, and gate). The anode and cathode are connected to the semiconductor material, while the gate is used to control the flow of current. When a small voltage is applied to the gate, it triggers the SCR to conduct, allowing current to flow from the anode to the cathode.

SCRs are widely used in various applications, including:

1. Power supplies: SCRs are used to regulate the output voltage and current in power supplies.
2. Motor control: SCRs are used to control the speed and direction of motors in industrial applications.
3. Lighting: SCRs are used to control the brightness and color of light bulbs.
4. Power grids: SCRs are used to regulate the flow of electrical power in power grids.

The importance of SCRs lies in their ability to:

1. Regulate power: SCRs can regulate the flow of electrical power, making them essential in power supplies and motor control applications.
2. Control current: SCRs can control the flow of current, making them useful in applications where precise current control is required.
3. Increase efficiency: SCRs can increase the efficiency of electrical systems by reducing energy losses.

The impact of SCRs is significant, as they have revolutionized the way electrical power is controlled and regulated. They have enabled the development of more efficient and reliable electrical systems, which has had a profound impact on various industries, including power generation, transmission, and distribution.

In summary, SCRs are a crucial component in electrical and electronic engineering, offering a wide range of applications and benefits. Their ability to regulate power, control current, and increase efficiency has made them an essential tool in various industries."
SCR-as-Full-Wave-Rectifier.jpg,"For full-wave rectification two SCRs are connected across the centre taped secondary, as shown in figure-a. The gates of both SCRs are supplied from two gate control supply circuits. One SCR conducts during the positive half cycle and the other during the negative half cycle and thus unidirectional current flows in the load circuit. The main advantage of this circuit over ordinary full-wave rectifier circuit is that the output voltage can be controlled by adjusting the gate current.",https://qkbjnciqtosdvknjsqeo.supabase.co/storage/v1/object/public/images/public/SCR-as-Full-Wave-Rectifier.jpg?,"In the context of electrical and electronic engineering, a SCR (Silicon-Controlled Rectifier) as a Full-Wave Rectifier refers to a circuit configuration that utilizes two SCRs to achieve full-wave rectification. This configuration is used to convert an alternating current (AC) input into a direct current (DC) output, with the capability to control the output voltage.

The usage of this circuit is widespread in power supplies, motor control, and other applications where a stable DC output is required. The importance of this circuit lies in its ability to provide a unidirectional current flow in the load circuit, which is essential for many electronic devices.

The impact of this circuit is significant, as it offers several advantages over traditional full-wave rectifier circuits. Firstly, the output voltage can be controlled by adjusting the gate current, allowing for a higher degree of flexibility in the design of power supplies and other applications. Secondly, the use of SCRs eliminates the need for diodes, which can be expensive and prone to failure. Finally, the circuit's ability to handle high voltage and current levels makes it suitable for a wide range of applications.

In summary, the SCR as a Full-Wave Rectifier is an important circuit configuration in electrical and electronic engineering, offering a controlled and efficient means of converting AC input to DC output. Its usage and importance are evident in various applications, and its impact is significant in terms of flexibility, cost-effectiveness, and reliability."
SCR-as-Half-Wave-Rectifier.jpg,"SCRs are used as controlled rectifiers in AC circuits, such as controlling DC motors from an AC supply. In a half-wave rectifier setup, an AC supply is applied to the transformer's primary, ensuring the negative voltage at the secondary is below the SCR's reverse breakdown voltage. The SCR conducts during the positive half-cycle if sufficient gate current is applied, controlled by a variable resistor. It remains non-conductive during the negative half-cycle. Once the SCR starts conducting at a certain positive voltage, it continues until the AC voltage drops to zero, repeating in each positive half-cycle.",https://qkbjnciqtosdvknjsqeo.supabase.co/storage/v1/object/public/images/public/SCR-as-Half-Wave-Rectifier.jpg?,"The topic SCR-as-Half-Wave-Rectifier refers to the application of Silicon-Controlled Rectifiers (SCRs) in AC circuits to achieve controlled rectification, specifically in half-wave rectification. In this setup, SCRs are used to convert AC voltage to DC voltage, allowing for the control of DC motors or other loads from an AC supply.

The usage of SCRs as half-wave rectifiers is crucial in electrical and electronic engineering, particularly in applications where a controlled DC output is required. This is achieved by applying an AC supply to the primary of a transformer, ensuring that the negative voltage at the secondary is below the SCR's reverse breakdown voltage. The SCR then conducts during the positive half-cycle, allowing the controlled DC output to be obtained.

The importance of SCRs as half-wave rectifiers lies in their ability to provide a controlled DC output, which is essential in various applications, such as:

*   Controlling DC motors from an AC supply
*   Providing a stable DC voltage for electronic circuits
*   Reducing the ripple factor in the DC output

The impact of SCRs as half-wave rectifiers is significant, as they offer a cost-effective and efficient solution for controlled rectification. By using SCRs, designers can achieve a high degree of control over the DC output, which is critical in many applications. Additionally, SCRs are relatively simple to implement and require minimal additional components, making them a popular choice for controlled rectification."
SCR-as-Inverter.PNG,"The image shows a simplified schematic diagram of an SCR (Silicon Controlled Rectifier) inverter circuit. The gate trigger is connected to the SCR1, which acts as a switch for the primary half-bridge circuit. The voltage source is connected to the input terminals and the output terminals are labeled with L and C respectively. The current flows from the input terminals through the primary half-bridge circuit to the output terminals.",https://qkbjnciqtosdvknjsqeo.supabase.co/storage/v1/object/public/images/public/SCR-as-Inverter.PNG?,"In the context of electrical and electronic engineering, an SCR (Silicon Controlled Rectifier) inverter is a type of power electronic converter that uses SCRs as switches to convert DC power to AC power. The SCR inverter is a crucial component in various applications, including power supplies, motor drives, and renewable energy systems.

The SCR inverter circuit consists of two SCRs, which act as switches to control the flow of current from the input DC voltage to the output AC voltage. The gate trigger of the first SCR (SCR1) is connected to a control circuit, which allows the SCR to be turned on or off. When the SCR1 is turned on, it acts as a closed switch, allowing the current to flow from the input terminals to the output terminals. The output voltage is then filtered and smoothed by the capacitor (C) and inductor (L) to produce a clean AC waveform.

The SCR inverter has several advantages, including high efficiency, simple circuit design, and low cost. It is also relatively easy to control the output voltage and frequency, making it a popular choice for various applications. The SCR inverter is widely used in power supplies for electronic devices, motor drives for industrial applications, and renewable energy systems, such as solar and wind power.

The SCR inverter also has a significant impact on the power quality and efficiency of the system. It can provide a high-quality AC output with a low total harmonic distortion (THD) and high power factor. Additionally, the SCR inverter can be used to implement advanced power electronic control strategies, such as pulse-width modulation (PWM) and space vector modulation (SVM), which can further improve the power quality and efficiency of the system."
SCR-as-contractor.PNG,"SCRs are used for switching operations, where they are referred to as static contactors due to their lack of moving parts. In the circuit, SCRs switch AC power to a load. During the positive half-cycle, diode D2 sends gate current to SCR1, turning it on and allowing current to flow through the load. In the negative half-cycle, SCR2 turns on, conducting current through the load. The switch handles only a small gate current, enabling the SCRs to control large currents in the load, offering an advantage over mechanical switches.",https://qkbjnciqtosdvknjsqeo.supabase.co/storage/v1/object/public/images/public/SCR-as-contractor.PNG?,"The topic SCR-as-contractor refers to the use of Silicon-Controlled Rectifiers (SCRs) as static contactors in electrical and electronic engineering. SCRs are semiconductor devices that can be used to switch AC power to a load, making them an essential component in various applications.

In the context of electrical and electronic engineering, SCRs are used for switching operations due to their ability to handle high currents and their lack of moving parts. This makes them a reliable and efficient alternative to mechanical switches. The importance of SCRs as contractors lies in their ability to control large currents with minimal gate current, making them an attractive solution for applications where high power handling is required.

The usage of SCRs as contractors is widespread in various industries, including power systems, industrial automation, and renewable energy. They are used in applications such as power conditioning, motor control, and power distribution. The advantages of SCRs as contractors include their high reliability, low maintenance, and ability to handle high currents, making them an essential component in many electrical and electronic systems.

In summary, SCRs as contractors offer a reliable and efficient solution for switching AC power in various applications, making them an important component in electrical and electronic engineering. Their ability to handle high currents and minimal gate current requirements make them an attractive solution for many industries."
