name,explanation,image_url,topic_description
Bipolar-Junction-Transistor.jpeg,"The image is a schematic diagram of a BJT (Bipolar Junction Transistor) transistor. The three terminals labeled C, B, and E represent the collector, base, and emitter regions of the transistor, respectively. The arrow in the diagram indicates the direction of current flow through the device.
",https://qkbjnciqtosdvknjsqeo.supabase.co/storage/v1/object/public/images/public/Bipolar-Junction-Transistor.jpeg?,"In the realm of electrical and electronic engineering, the Bipolar-Junction-Transistor (BJT) is a fundamental building block of modern electronics. A BJT is a type of transistor that uses both positive and negative charge carriers (holes and electrons) to control the flow of current. This device has revolutionized the field of electronics by enabling the amplification and switching of electrical signals.

A BJT consists of three layers of semiconductor material, typically silicon, with two p-n junctions. The three terminals of the transistor are the emitter (E), base (B), and collector (C). The emitter is the region where the majority charge carriers are injected into the transistor, while the collector is the region where the majority charge carriers are collected. The base is the region that controls the flow of current between the emitter and collector.

In a BJT, the base-emitter junction is forward-biased, allowing electrons to flow from the emitter to the base, while the base-collector junction is reverse-biased, preventing electrons from flowing directly from the base to the collector. This configuration allows the transistor to amplify or switch electrical signals.

BJTs are widely used in various applications, including amplifiers, switches, and voltage regulators. They are also used in complex electronic circuits, such as computers, smartphones, and televisions. The importance of BJT lies in its ability to control the flow of current, which enables the amplification and switching of electrical signals. This has led to the development of many modern technologies, including digital communication systems, medical equipment, and industrial automation.

In addition, BJT has had a significant impact on the field of electronics by enabling the creation of smaller, faster, and more efficient electronic devices. The transistor's ability to amplify and switch signals has led to the development of many modern technologies, including the internet, mobile phones, and medical imaging devices. Overall, the Bipolar-Junction-Transistor is a fundamental device in electrical and electronic engineering, and its impact on modern technology cannot be overstated."
CLASS-A-AMPLIFIER.png,"In a Class A amplifier, the output voltage (Vout) is not simply the sum of the input voltage (Vin) and the quiescent current (Ic). The output is actually the amplified version of the input signal. Also, the base of an NPN transistor in a Class A amplifier is typically connected to the input signal, not to the collector. The collector is connected to the load and the positive supply (Vcc), while the emitter is usually connected to ground",https://qkbjnciqtosdvknjsqeo.supabase.co/storage/v1/object/public/images/public/CLASS-A-AMPLIFIER.png?,"A Class A amplifier is a type of electronic amplifier that is widely used in various applications, including audio equipment, medical devices, and industrial control systems. In this configuration, the output voltage is directly proportional to the input voltage, and the quiescent current (Ic) is constant. This means that the output voltage is the amplified version of the input signal, with minimal distortion.

The importance of Class A amplifiers lies in their ability to provide a linear amplification of the input signal, making them suitable for applications where accurate reproduction of the original signal is crucial. They are often used in audio equipment, such as preamplifiers and power amplifiers, where the goal is to faithfully reproduce the original sound.

The usage of Class A amplifiers is widespread, and they are commonly found in:

1. Audio equipment: Preamp, power amp, and headphone amplifiers.
2. Medical devices: Electrocardiogram (ECG) machines and ultrasound devices.
3. Industrial control systems: Speedometers, tachometers, and vibration sensors.
4. Telecommunications: Amplifiers for wireless communication systems.

The impact of Class A amplifiers is significant, as they enable the accurate transmission and reception of signals in various applications. Their ability to provide a linear amplification of the input signal makes them an essential component in many industries.

In summary, Class A amplifiers are a crucial component in many electronic systems, providing a linear amplification of the input signal with minimal distortion. Their widespread usage and importance in various industries make them a fundamental concept in electrical and electronic engineering."
DARLINGTON-PNP.png,"The description is incorrect. In a PNP Darlington transistor, the current flows from the emitter to the collector when the transistor is turned on, not from the base to the collector. The base terminal controls the transistor, but the current flow is from the emitter to the collector in a PNP configuration",https://qkbjnciqtosdvknjsqeo.supabase.co/storage/v1/object/public/images/public/DARLINGTON-PNP.png?,"The Darlington-PNP (DARLINGTON-PNP) is a type of transistor configuration that combines two PNP transistors in a single package, creating a high-current gain amplifier. In this configuration, the current flows from the emitter to the collector when the transistor is turned on.

The Darlington-PNP is an important device in electrical and electronic engineering, particularly in applications where high current gain is required. It is used in a wide range of applications, including power supplies, motor control, and audio amplifiers. The Darlington-PNP's high current gain and low input impedance make it an ideal choice for applications where a high current output is needed.

The importance of the Darlington-PNP lies in its ability to amplify weak input signals to produce a strong output signal. This is particularly useful in applications where the input signal is small, such as in audio amplifiers or motor control circuits. Additionally, the Darlington-PNP's high current gain and low input impedance make it a reliable choice for applications where high current output is required.

The impact of the Darlington-PNP on electrical and electronic engineering is significant. It has enabled the development of many modern electronic devices, including power supplies, motor control systems, and audio amplifiers. The Darlington-PNP's high current gain and low input impedance have made it an essential component in many electronic circuits.

In summary, the Darlington-PNP is a high-current gain amplifier that is used in a wide range of applications in electrical and electronic engineering. Its high current gain and low input impedance make it an ideal choice for applications where high current output is required, and its impact on the development of modern electronic devices has been significant."
DARLINGTON1-NPN.png," An NPN Darlington transistor consists of three parts: the base, collector, and emitter. The red line should represent the collector, but the base and emitter are also crucial components. Additionally, the ""NPN"" refers to the arrangement of the semiconductor materials, where the base is P-type and the collector and emitter are N-type",https://qkbjnciqtosdvknjsqeo.supabase.co/storage/v1/object/public/images/public/DARLINGTON1-NPN.png?,"DARLINGTON1-NPN refers to a type of Darlington transistor, a crucial component in electrical and electronic engineering. A Darlington transistor is a composite device consisting of two transistors, a PNP and an NPN, connected in a specific way to form a single transistor with a high current gain. This allows for the amplification of weak signals and the switching of high currents.

The DARLINGTON1-NPN transistor is an NPN Darlington transistor, which means it has a base that is P-type and a collector and emitter that are N-type. This arrangement is crucial for the proper functioning of the transistor. The collector is typically represented by the red line, but the base and emitter are also vital components.

In electrical and electronic engineering, DARLINGTON1-NPN transistors are used in a wide range of applications, including amplifiers, switches, and voltage regulators. They are particularly useful in situations where high current gain and high switching speeds are required. The transistor's high current gain and low input impedance make it an essential component in many electronic circuits.

The importance of DARLINGTON1-NPN transistors lies in their ability to amplify weak signals and switch high currents with high efficiency. They are used in many modern electronic devices, including audio equipment, computers, and industrial control systems. The transistor's reliability and durability make it a popular choice among engineers and designers.

In summary, DARLINGTON1-NPN is a type of Darlington transistor that plays a vital role in electrical and electronic engineering. Its high current gain, low input impedance, and reliability make it an essential component in many electronic circuits."
Diode-Characteristics-Curve.png,"The image is a diagram that shows the characteristics of a diode, which is an electronic component used to allow or block current flow in a circuit. The forward bias region represents when the diode is conducting electricity, while the reverse breakdown region indicates when the diode breaks down and starts to conduct more than it should. The voltage across the diode is also shown on the graph.
",https://qkbjnciqtosdvknjsqeo.supabase.co/storage/v1/object/public/images/public/Diode-Characteristics-Curve.png?,"The Diode-Characteristics-Curve is a fundamental concept in electrical and electronic engineering that describes the relationship between the voltage and current of a diode. A diode is a semiconductor device that allows current to flow in one direction while blocking it in the other. The characteristics curve, also known as the I-V curve, is a graphical representation of the diode's behavior under various operating conditions.

The curve consists of three main regions: the forward bias region, the reverse breakdown region, and the cut-off region. In the forward bias region, the diode conducts electricity and the current increases exponentially with the voltage. This region is important for designing diode-based circuits, such as rectifiers and voltage regulators. The reverse breakdown region, on the other hand, is a critical area where the diode breaks down and starts to conduct more than it should, potentially causing damage to the circuit.

Understanding the diode characteristics curve is essential for designing and analyzing electronic circuits that employ diodes. It allows engineers to predict the behavior of the diode under different operating conditions, ensuring that the circuit operates within safe limits and performs as intended. The curve also provides valuable information for selecting diodes with appropriate characteristics for specific applications.

In addition, the diode characteristics curve has significant implications for the design of power electronic devices, such as power supplies, motor drives, and renewable energy systems. By understanding the diode's behavior, engineers can optimize circuit performance, minimize losses, and ensure reliable operation."
Field-Effect-Transistor.jpg,"The image shows a schematic diagram of a transistor-based amplifier circuit. The input signal (Vin) is applied to the base of the transistor, which controls the current flow between the collector and emitter terminals. When a small voltage is applied to the base, it allows a larger current to flow from the collector to the emitter. Resistor 𝑅𝐶
 limits the current through the collector, while resistor 𝑅𝐸 provides a path for the emitter current. The output signal (Vout) is taken from the collector.Resistor 𝑅𝐵  connected between the base and emitter, stabilizes the base-emitter voltage, ensuring consistent transistor operation. This circuit is commonly used in audio applications for amplifying small input signals with minimal distortion",https://qkbjnciqtosdvknjsqeo.supabase.co/storage/v1/object/public/images/public/Field-Effect-Transistor.jpg?,"A Field-Effect Transistor (FET) is a type of transistor that uses an electric field to control the flow of current between two terminals. In the context of electrical and electronic engineering, FETs are widely used in amplifier circuits, switches, and voltage regulators due to their high input impedance, low noise, and ability to operate at high frequencies.

FETs are used to amplify weak signals, such as those from microphones or sensors, without introducing significant distortion. They are also used in audio applications, where a small input signal needs to be amplified to drive a speaker or headphones. The circuit shown in the image is a common amplifier circuit that utilizes a transistor to amplify the input signal.

The importance of FETs lies in their ability to provide a high degree of control over the current flow, making them ideal for applications where precision is crucial. They are also relatively low-power devices, which makes them suitable for battery-powered devices. Additionally, FETs have a high input impedance, which means they do not load the input signal, allowing for accurate measurement and amplification.

The impact of FETs on electrical and electronic engineering is significant, as they have enabled the development of high-performance amplifier circuits, switches, and voltage regulators. They have also enabled the creation of compact and portable devices, such as radios, televisions, and smartphones, which rely on FET-based amplifier circuits to amplify weak signals and drive speakers or headphones.

In summary, FETs are a crucial component in electrical and electronic engineering, providing a high degree of control over current flow, low noise, and high input impedance, making them ideal for amplifier circuits, switches, and voltage regulators. Their importance lies in their ability to amplify weak signals without distortion, and their impact has been significant in the development of high-performance devices."
forward-biasing-circuit.jpg,"The image is a diagram that illustrates the forward bias in a diode. The red and blue arrows represent the flow of current through the device, while the black box represents the voltage supply. The text ""Forward Bias"" at the top indicates that this is an example of a forward-biased diode.
",https://qkbjnciqtosdvknjsqeo.supabase.co/storage/v1/object/public/images/public/forward-biasing-circuit.jpg?,"In the context of electrical and electronic engineering, a forward-biasing circuit is a fundamental concept that plays a crucial role in the operation of semiconductor devices, particularly diodes. Forward-biasing is a technique used to control the flow of electric current through a diode, allowing it to conduct electricity in one direction while blocking it in the other.

In a forward-biasing circuit, a voltage is applied across the diode in such a way that the positive terminal of the voltage source is connected to the anode of the diode, while the negative terminal is connected to the cathode. This configuration causes the diode to conduct electricity, allowing current to flow through it. The forward-biasing circuit is essential in various applications, including rectification, filtering, and amplification.

The importance of forward-biasing circuits lies in their ability to control the flow of current through the diode. By adjusting the voltage applied across the diode, engineers can tailor the circuit's performance to meet specific requirements. This flexibility makes forward-biasing circuits indispensable in modern electronics, where precise control over current flow is critical.

The impact of forward-biasing circuits is significant, as they enable the creation of complex electronic systems that rely on diodes to perform various functions. From simple rectifiers to complex amplifiers, forward-biasing circuits are the backbone of many electronic devices. Their widespread use has led to the development of innovative technologies, such as power supplies, audio equipment, and medical devices, which rely on the principles of forward-biasing to operate effectively.

In summary, forward-biasing circuits are a vital component of electrical and electronic engineering, allowing engineers to control the flow of current through diodes and enabling the creation of complex electronic systems that rely on diodes to perform various functions."
tunnel-diode.jpeg,"The image represents the structure of a tunnel diode. Typically, the anode is depicted as a black dot or circle, and the cathode is shown with a different symbol, often a line or another distinct mark. The red lines indicate the connection between the anode and cathode. The text 'Tunnel Diode Symbols' highlights that this diagram illustrates the standard symbols used for tunnel diodes in circuit diagrams",https://qkbjnciqtosdvknjsqeo.supabase.co/storage/v1/object/public/images/public/tunnel-diode.jpeg?,"A tunnel diode is a type of semiconductor device that exhibits negative resistance, meaning its current decreases as the voltage increases. This unique property makes it an essential component in various electronic circuits, particularly in oscillator and amplifier applications.

The tunnel diode consists of two closely spaced regions of p-type and n-type semiconductor materials, typically made of gallium arsenide (GaAs) or silicon (Si). When a small voltage is applied across the diode, the current flowing through it is relatively low. However, as the voltage increases, the current starts to decrease, creating a negative resistance region. This behavior is due to the quantum mechanical phenomenon of tunneling, where electrons can pass through the potential barrier between the two regions.

Tunnel diodes are used in various applications, including:

1. **Oscillators**: Tunnel diodes are used to generate microwave frequencies in oscillator circuits. Their negative resistance property allows them to sustain oscillations at high frequencies.
2. **Amplifiers**: Tunnel diodes can be used as high-frequency amplifiers, taking advantage of their negative resistance region to amplify weak signals.
3. **Switching circuits**: Tunnel diodes can be used as switches, where the negative resistance region allows them to switch between two states.
4. **Microwave circuits**: Tunnel diodes are used in microwave circuits, such as mixers, multipliers, and attenuators.

The importance of tunnel diodes lies in their ability to generate high-frequency signals and their use in various applications that require negative resistance. Their unique property makes them an essential component in the development of modern electronic devices.

In summary, tunnel diodes are semiconductor devices that exhibit negative resistance, making them useful in oscillator, amplifier, and switching circuits. Their importance lies in their ability to generate high-frequency signals and their use in various applications that require negative resistance."
transistor-as-an-amplifier.jpg,"The image is a schematic diagram of a transistor-based amplifier circuit. The input signal (Vin) is applied to the base of the transistor, which acts as an electronic switch that controls the flow of current between the collector and emitter terminals. When the transistor is turned on by applying a small voltage to its base terminal, it allows a larger current to flow from the collector to the emitter, controlled by the resistor values Rc and Re.

In this circuit, the output signal (Vout) is taken from the collector-emitter junction. The resistor Rc limits the current through the transistor, while the resistor Re provides a path for the current to flow out of the transistor. This configuration is often used in amplifiers because it can control the amount of current flowing through the transistor, allowing for more precise control over the output signal.

The resistor Rb is connected between the base and emitter terminals of the transistor, providing a stable connection for the base-emitter junction. The resistor Rb also helps to stabilize the base-emitter junction's voltage, ensuring consistent operation of the transistor.

This circuit is commonly used in audio applications where small changes in the input signal need to be amplified without significant distortion. By controlling the flow of current through the transistor, the output signal can be adjusted to match the desired level of amplification.",https://qkbjnciqtosdvknjsqeo.supabase.co/storage/v1/object/public/images/public/transistor-as-an-amplifier.jpg?,"The transistor-as-an-amplifier is a fundamental concept in electrical and electronic engineering, where a transistor is used to amplify weak electrical signals. In this context, a transistor acts as an electronic switch that controls the flow of current between its collector and emitter terminals. By applying a small voltage to the base terminal, the transistor can be turned on or off, allowing a larger current to flow through it.

The transistor-as-an-amplifier is crucial in various applications, including audio equipment, telecommunications, and medical devices. Its importance lies in its ability to amplify weak signals without significant distortion, making it an essential component in many modern devices. The transistor-as-an-amplifier is also used in a wide range of frequencies, from low-frequency audio signals to high-frequency radio signals.

The transistor-as-an-amplifier has a significant impact on the field of electrical and electronic engineering. It has enabled the development of modern communication systems, audio equipment, and medical devices that rely on the amplification of weak signals. The transistor-as-an-amplifier has also led to the creation of new technologies, such as transistors, integrated circuits, and microprocessors, which have revolutionized the field of electrical and electronic engineering.

In summary, the transistor-as-an-amplifier is a vital concept in electrical and electronic engineering, enabling the amplification of weak signals and having a significant impact on various applications and technologies. Its importance lies in its ability to amplify signals without distortion, making it an essential component in many modern devices."
sawtooth-generator.png,"The image depicts a sawtooth generator circuit, which produces a sawtooth waveform. The diagram shows connections between various components such as resistors and capacitors. The voltage across resistor 
𝑅1 s 200 V, while the voltage across 𝑅2 is not explicitly stated but can be assumed to be similar. The current through R 1is represented by 𝐼(𝑡) , given by the formula (𝑡/10)⋅𝑒−0.5𝑡(t/10)⋅e −0.5t .The current through R 2  is also shown, though its exact value is not provided.The plot labeled 'FGC1122' shows the sawtooth waveform output of the generator. The voltage across resistor  R 3 is 12 V, and resistor R4  has a resistance of 100 kΩ. The plot labeled 'GTO unilateral oscillator' indicates another component in the circuit, but its specific function is not detailed in the image",https://qkbjnciqtosdvknjsqeo.supabase.co/storage/v1/object/public/images/public/sawtooth-generator.png?,"The sawtooth generator is a crucial component in electrical and electronic engineering, particularly in the design of oscillators, filters, and signal processing systems. It produces a sawtooth waveform, which is a periodic signal with a triangular shape and a linearly increasing or decreasing slope. This waveform is essential in various applications, including:

1. **Voltage-controlled oscillators (VCOs)**: Sawtooth generators are used in VCOs to produce a stable frequency signal that can be controlled by an external voltage.
2. **Frequency synthesizers**: Sawtooth generators are employed in frequency synthesizers to generate a stable reference frequency, which is then used to produce a variety of frequencies.
3. **Analog-to-digital converters (ADCs)**: Sawtooth generators are used in ADCs to produce a sawtooth waveform, which is then used to sample an analog signal and convert it into a digital signal.
4. **Signal processing**: Sawtooth generators are used in signal processing systems to produce a sawtooth waveform, which can be used to filter, amplify, or modulate signals.

The sawtooth generator circuit, as depicted in the image, consists of resistors and capacitors connected in a specific configuration. The circuit produces a sawtooth waveform with a specific amplitude and frequency. The voltage across resistor R1 is 200 V, indicating that the circuit is designed to produce a high-amplitude sawtooth waveform.

The importance of sawtooth generators lies in their ability to produce a stable and precise sawtooth waveform, which is essential in many applications. The sawtooth generator circuit is a fundamental building block in the design of various electronic systems, and its impact is felt in many areas of electrical and electronic engineering.

The sawtooth generator has a significant impact on the design of electronic systems, enabling the production of stable and precise signals. Its applications are diverse, and its importance cannot be overstated in the field of electrical and electronic engineering."
